{
  "protocol_version": "0.1",
  "contract_revision": "R9",
  "command": "lock.delete",
  "context": {
    "profile": "prod"
  },
  "input": {
    "xid": "10.0.0.1:8091:123",
    "branch_id": "123",
    "resource_id": "jdbc:mysql://db.example.com/orders",
    "table_name": "orders",
    "pk": "42"
  },
  "options": {
    "timeout_ms": 30000,
    "client_request_id": "00000038-44d2-4ca8-8b6d-5b40c3e6d016",
    "confirm_high_risk": true
  }
}
